{
  "artifact_kind": "review_invocation_set",
  "review_prompt_contract": "run-artifacts/agentsflow/runs/2026-06-23-v0.2-pr-merge-readiness-daed76c/review-prompt-contract.yaml",
  "status": "completed",
  "started_at": "2026-06-23T10:14:07.162430+00:00",
  "finished_at": "2026-06-23T10:18:14.121188+00:00",
  "runner_scheduling": "external-first-async",
  "provider_model_families": [
    "claude-code/opus",
    "internal-agent/codex"
  ],
  "reviewers": [
    {
      "reviewer": "verification-codex",
      "provider": "internal-agent",
      "model_family": "codex",
      "packet_path": "run-artifacts/agentsflow/runs/2026-06-23-v0.2-pr-merge-readiness-daed76c/review-packets/verification-codex.json",
      "report_path": "run-artifacts/agentsflow/runs/2026-06-23-v0.2-pr-merge-readiness-daed76c/reviewer-report.verification-codex.json",
      "checked_at": "2026-06-23T10:14:07.221821+00:00",
      "evidence_model_family": "codex",
      "status": "report-present"
    },
    {
      "reviewer": "verification-claude",
      "provider": "claude-code",
      "model_family": "opus",
      "packet_path": "run-artifacts/agentsflow/runs/2026-06-23-v0.2-pr-merge-readiness-daed76c/review-packets/verification-claude.json",
      "report_path": "run-artifacts/agentsflow/runs/2026-06-23-v0.2-pr-merge-readiness-daed76c/reviewer-report.verification-claude.json",
      "raw_output_path": "",
      "invocation_metadata_path": "run-artifacts/agentsflow/runs/2026-06-23-v0.2-pr-merge-readiness-daed76c/reviewer-invocation.verification-claude.json",
      "status": "invoked",
      "dispatch_started_at": "2026-06-23T10:14:07.216178+00:00",
      "last_progress_at": "2026-06-23T10:18:08.706055+00:00",
      "dispatch_finished_at": "2026-06-23T10:18:11.028113+00:00",
      "stdout": "External reviewer report written to run-artifacts/agentsflow/runs/2026-06-23-v0.2-pr-merge-readiness-daed76c/reviewer-report.verification-claude.json\n",
      "stderr": "",
      "exit_code": 0,
      "requested_model": "opus",
      "requested_effort": "max",
      "execution_mode": "real",
      "provider_models_used": [
        "claude-haiku-4-5-20251001",
        "claude-opus-4-8"
      ],
      "provider_total_cost_usd": 0.5692659999999999,
      "provider_service_tier": "standard",
      "provider_speed": "standard",
      "raw_output_hash": "sha256:12d50b4bcc4eeb2e388fb2be6278933e50ac4e4bbb07dfd4666275e83db83067",
      "normalized_output_hash": "sha256:992b48c59227a46b83da8aabf062e6f16947e01c4bb5df9e6dc37e879106b6e4",
      "evidence_model_family": "opus"
    },
    {
      "reviewer": "architecture-codex",
      "provider": "internal-agent",
      "model_family": "codex",
      "packet_path": "run-artifacts/agentsflow/runs/2026-06-23-v0.2-pr-merge-readiness-daed76c/review-packets/architecture-codex.json",
      "report_path": "run-artifacts/agentsflow/runs/2026-06-23-v0.2-pr-merge-readiness-daed76c/reviewer-report.architecture-codex.json",
      "checked_at": "2026-06-23T10:14:07.222659+00:00",
      "evidence_model_family": "codex",
      "status": "report-present"
    },
    {
      "reviewer": "architecture-claude",
      "provider": "claude-code",
      "model_family": "opus",
      "packet_path": "run-artifacts/agentsflow/runs/2026-06-23-v0.2-pr-merge-readiness-daed76c/review-packets/architecture-claude.json",
      "report_path": "run-artifacts/agentsflow/runs/2026-06-23-v0.2-pr-merge-readiness-daed76c/reviewer-report.architecture-claude.json",
      "raw_output_path": "",
      "invocation_metadata_path": "run-artifacts/agentsflow/runs/2026-06-23-v0.2-pr-merge-readiness-daed76c/reviewer-invocation.architecture-claude.json",
      "status": "invoked",
      "dispatch_started_at": "2026-06-23T10:14:07.217678+00:00",
      "last_progress_at": "2026-06-23T10:17:08.447553+00:00",
      "dispatch_finished_at": "2026-06-23T10:17:28.443063+00:00",
      "stdout": "External reviewer report written to run-artifacts/agentsflow/runs/2026-06-23-v0.2-pr-merge-readiness-daed76c/reviewer-report.architecture-claude.json\n",
      "stderr": "",
      "exit_code": 0,
      "requested_model": "opus",
      "requested_effort": "max",
      "execution_mode": "real",
      "provider_models_used": [
        "claude-haiku-4-5-20251001",
        "claude-opus-4-8"
      ],
      "provider_total_cost_usd": 0.48607300000000003,
      "provider_service_tier": "standard",
      "provider_speed": "standard",
      "raw_output_hash": "sha256:2ff4f57553fee9f18b4a76315c04896dafe80f96fc3b684a9ac664267967f56a",
      "normalized_output_hash": "sha256:f787409eeb49431ae2e0b42c57e7051c01ecd8124f4a4d9197a2dba0f01b7f84",
      "evidence_model_family": "opus"
    },
    {
      "reviewer": "adversarial-codex",
      "provider": "internal-agent",
      "model_family": "codex",
      "packet_path": "run-artifacts/agentsflow/runs/2026-06-23-v0.2-pr-merge-readiness-daed76c/review-packets/adversarial-codex.json",
      "report_path": "run-artifacts/agentsflow/runs/2026-06-23-v0.2-pr-merge-readiness-daed76c/reviewer-report.adversarial-codex.json",
      "checked_at": "2026-06-23T10:14:07.223091+00:00",
      "evidence_model_family": "codex",
      "status": "report-present"
    },
    {
      "reviewer": "adversarial-claude",
      "provider": "claude-code",
      "model_family": "opus",
      "packet_path": "run-artifacts/agentsflow/runs/2026-06-23-v0.2-pr-merge-readiness-daed76c/review-packets/adversarial-claude.json",
      "report_path": "run-artifacts/agentsflow/runs/2026-06-23-v0.2-pr-merge-readiness-daed76c/reviewer-report.adversarial-claude.json",
      "raw_output_path": "",
      "invocation_metadata_path": "run-artifacts/agentsflow/runs/2026-06-23-v0.2-pr-merge-readiness-daed76c/reviewer-invocation.adversarial-claude.json",
      "status": "invoked",
      "dispatch_started_at": "2026-06-23T10:14:07.218975+00:00",
      "last_progress_at": "2026-06-23T10:18:08.706118+00:00",
      "dispatch_finished_at": "2026-06-23T10:18:14.120560+00:00",
      "stdout": "External reviewer report written to run-artifacts/agentsflow/runs/2026-06-23-v0.2-pr-merge-readiness-daed76c/reviewer-report.adversarial-claude.json\n",
      "stderr": "",
      "exit_code": 0,
      "requested_model": "opus",
      "requested_effort": "max",
      "execution_mode": "real",
      "provider_models_used": [
        "claude-haiku-4-5-20251001",
        "claude-opus-4-8"
      ],
      "provider_total_cost_usd": 0.5699439999999999,
      "provider_service_tier": "standard",
      "provider_speed": "standard",
      "raw_output_hash": "sha256:918e9da0eeb33240b63afc5bcd906d63b1181dd0400c2a2fee29f15752c0a0c4",
      "normalized_output_hash": "sha256:a32baf488d93ec9fe02831d306dda62e855c1d1db3b2bcb885bf6b73794d131e",
      "evidence_model_family": "opus"
    }
  ],
  "artifact_preparation_report": "run-artifacts/agentsflow/runs/2026-06-23-v0.2-pr-merge-readiness-daed76c/review-artifact-preparation.json",
  "artifact_preparation_report_hash": "sha256:da18b806b280b9d2a72e7a47e8c6d5590ae4a696f49517416a0c8d8853a8a72e"
}
