{
  "artifact_kind": "review_invocation_set",
  "review_prompt_contract": "run-artifacts/agentsflow/runs/2026-06-23-pr-readiness-github-publication-focused-review-rerun/review-prompt-contract.yaml",
  "status": "completed",
  "started_at": "2026-06-23T12:48:44.377545+00:00",
  "finished_at": "2026-06-23T12:55:50.326993+00:00",
  "runner_scheduling": "external-first-async",
  "provider_model_families": [
    "claude-code/opus",
    "internal-agent/codex"
  ],
  "reviewers": [
    {
      "reviewer": "publication-rerun-codex",
      "provider": "internal-agent",
      "model_family": "codex",
      "packet_path": "/Users/alex/AgentsFlow/run-artifacts/agentsflow/runs/2026-06-23-pr-readiness-github-publication-focused-review-rerun/review-packets/publication-rerun-codex.json",
      "report_path": "/Users/alex/AgentsFlow/run-artifacts/agentsflow/runs/2026-06-23-pr-readiness-github-publication-focused-review-rerun/reviewer-report.publication-rerun-codex.json",
      "checked_at": "2026-06-23T12:53:08.209633+00:00",
      "status": "report-present",
      "evidence_model_family": "codex"
    },
    {
      "reviewer": "publication-rerun-claude",
      "provider": "claude-code",
      "model_family": "opus",
      "packet_path": "/Users/alex/AgentsFlow/run-artifacts/agentsflow/runs/2026-06-23-pr-readiness-github-publication-focused-review-rerun/review-packets/publication-rerun-claude.json",
      "report_path": "/Users/alex/AgentsFlow/run-artifacts/agentsflow/runs/2026-06-23-pr-readiness-github-publication-focused-review-rerun/reviewer-report.publication-rerun-claude.json",
      "raw_output_path": "",
      "invocation_metadata_path": "/Users/alex/AgentsFlow/run-artifacts/agentsflow/runs/2026-06-23-pr-readiness-github-publication-focused-review-rerun/reviewer-invocation.publication-rerun-claude.json",
      "status": "invoked",
      "dispatch_started_at": "2026-06-23T12:48:44.405003+00:00",
      "last_progress_at": "2026-06-23T12:55:39.052543+00:00",
      "dispatch_finished_at": "2026-06-23T12:55:50.325970+00:00",
      "stdout": "External reviewer report written to /Users/alex/AgentsFlow/run-artifacts/agentsflow/runs/2026-06-23-pr-readiness-github-publication-focused-review-rerun/reviewer-report.publication-rerun-claude.json\n",
      "stderr": "",
      "exit_code": 0,
      "requested_model": "opus",
      "requested_effort": "max",
      "execution_mode": "real",
      "provider_models_used": [
        "claude-haiku-4-5-20251001",
        "claude-opus-4-8"
      ],
      "provider_total_cost_usd": 1.193174,
      "provider_service_tier": "standard",
      "provider_speed": "standard",
      "raw_output_hash": "sha256:a4dc1b71f3ea3b68de2b8c880a414e29bcd873d4f46224f328630fee065eb95c",
      "normalized_output_hash": "sha256:19847d2b8f461c93b68481dbd477aac931c62f83dfecd9b2d9dd5aedc11fd620",
      "evidence_model_family": "opus"
    }
  ],
  "artifact_preparation_report": "run-artifacts/agentsflow/runs/2026-06-23-pr-readiness-github-publication-focused-review-rerun/review-artifact-preparation.json",
  "artifact_preparation_report_hash": "sha256:91c93781488dc62d66e48ca889b8b069e9dc858baea9d4b72ebba0b3ce7ccc54"
}
