{
  "artifact_kind": "review_invocation_set",
  "review_prompt_contract": "run-artifacts/agentsflow/runs/2026-06-21-pr-merge-readiness/review-prompt-contract.yaml",
  "artifact_preparation_report": "run-artifacts/agentsflow/runs/2026-06-21-pr-merge-readiness/review-artifact-preparation.json",
  "artifact_preparation_report_hash": "sha256:5b286181c1bfca54152e4031e00dfe6c1185fe9042d08a87ea37f66ecde84f1c",
  "status": "predeclared",
  "provider_model_families": [
    "internal-agent/codex"
  ],
  "reviewers": [
    {
      "reviewer": "hygiene-codex-generalist-a",
      "provider": "internal-agent",
      "model_family": "codex",
      "packet_path": "run-artifacts/agentsflow/runs/2026-06-21-pr-merge-readiness/review-packets/hygiene-codex-generalist-a.json",
      "report_path": "run-artifacts/agentsflow/runs/2026-06-21-pr-merge-readiness/reviewer-report.hygiene-codex-generalist-a.json",
      "status": "predeclared"
    },
    {
      "reviewer": "hygiene-codex-generalist-b",
      "provider": "internal-agent",
      "model_family": "codex",
      "packet_path": "run-artifacts/agentsflow/runs/2026-06-21-pr-merge-readiness/review-packets/hygiene-codex-generalist-b.json",
      "report_path": "run-artifacts/agentsflow/runs/2026-06-21-pr-merge-readiness/reviewer-report.hygiene-codex-generalist-b.json",
      "status": "predeclared"
    }
  ]
}
