{
  "artifact_kind": "review_invocation_set",
  "review_prompt_contract": "run-artifacts/agentsflow/runs/2026-06-23-v0.2-pr-merge-readiness-rerun/review-prompt-contract.yaml",
  "status": "failed",
  "started_at": "2026-06-23T08:16:49.161151+00:00",
  "finished_at": "2026-06-23T08:26:23.215922+00:00",
  "runner_scheduling": "external-first-async",
  "provider_model_families": [],
  "reviewers": [
    {
      "reviewer": "verification-codex",
      "provider": "internal-agent",
      "model_family": "codex",
      "packet_path": "run-artifacts/agentsflow/runs/2026-06-23-v0.2-pr-merge-readiness-rerun/review-packets/verification-codex.json",
      "report_path": "run-artifacts/agentsflow/runs/2026-06-23-v0.2-pr-merge-readiness-rerun/reviewer-report.verification-codex.json",
      "checked_at": "2026-06-23T08:26:23.210616+00:00",
      "status": "report-present",
      "evidence_model_family": "codex"
    },
    {
      "reviewer": "verification-claude",
      "provider": "claude-code",
      "model_family": "opus",
      "packet_path": "run-artifacts/agentsflow/runs/2026-06-23-v0.2-pr-merge-readiness-rerun/review-packets/verification-claude.json",
      "report_path": "run-artifacts/agentsflow/runs/2026-06-23-v0.2-pr-merge-readiness-rerun/reviewer-report.verification-claude.json",
      "raw_output_path": "run-artifacts/agentsflow/runs/2026-06-23-v0.2-pr-merge-readiness-rerun/evidence/raw/verification-claude.raw.json",
      "invocation_metadata_path": "run-artifacts/agentsflow/runs/2026-06-23-v0.2-pr-merge-readiness-rerun/evidence/stale-external-invocations/8a2c197/reviewer-invocation.verification-claude.json",
      "status": "failed",
      "dispatch_started_at": "2026-06-23T08:16:49.211487+00:00",
      "dispatch_finished_at": "2026-06-23T08:26:23.215682+00:00",
      "stdout": "",
      "stderr": "external reviewer failed: Claude Code provider result must contain reviewer-report JSON\n",
      "exit_code": 2,
      "error": "external reviewer verification-claude failed: external reviewer failed: Claude Code provider result must contain reviewer-report JSON\n"
    },
    {
      "reviewer": "architecture-codex",
      "provider": "internal-agent",
      "model_family": "codex",
      "packet_path": "run-artifacts/agentsflow/runs/2026-06-23-v0.2-pr-merge-readiness-rerun/review-packets/architecture-codex.json",
      "report_path": "run-artifacts/agentsflow/runs/2026-06-23-v0.2-pr-merge-readiness-rerun/reviewer-report.architecture-codex.json",
      "checked_at": "2026-06-23T08:26:23.214445+00:00",
      "evidence_model_family": "codex",
      "status": "report-present"
    },
    {
      "reviewer": "architecture-claude",
      "provider": "claude-code",
      "model_family": "opus",
      "packet_path": "run-artifacts/agentsflow/runs/2026-06-23-v0.2-pr-merge-readiness-rerun/review-packets/architecture-claude.json",
      "report_path": "run-artifacts/agentsflow/runs/2026-06-23-v0.2-pr-merge-readiness-rerun/reviewer-report.architecture-claude.json",
      "raw_output_path": "run-artifacts/agentsflow/runs/2026-06-23-v0.2-pr-merge-readiness-rerun/evidence/raw/architecture-claude.raw.json",
      "invocation_metadata_path": "run-artifacts/agentsflow/runs/2026-06-23-v0.2-pr-merge-readiness-rerun/evidence/stale-external-invocations/8a2c197/reviewer-invocation.architecture-claude.json",
      "status": "failed",
      "dispatch_started_at": "2026-06-23T08:16:49.213194+00:00",
      "dispatch_finished_at": "2026-06-23T08:26:23.215792+00:00",
      "stdout": "",
      "stderr": "external reviewer failed: Claude Code provider result must contain reviewer-report JSON\n",
      "exit_code": 2,
      "error": "external reviewer architecture-claude failed: external reviewer failed: Claude Code provider result must contain reviewer-report JSON\n"
    },
    {
      "reviewer": "adversarial-codex",
      "provider": "internal-agent",
      "model_family": "codex",
      "packet_path": "run-artifacts/agentsflow/runs/2026-06-23-v0.2-pr-merge-readiness-rerun/review-packets/adversarial-codex.json",
      "report_path": "run-artifacts/agentsflow/runs/2026-06-23-v0.2-pr-merge-readiness-rerun/reviewer-report.adversarial-codex.json",
      "checked_at": "2026-06-23T08:26:23.215080+00:00",
      "evidence_model_family": "codex",
      "status": "report-present"
    },
    {
      "reviewer": "adversarial-claude",
      "provider": "claude-code",
      "model_family": "opus",
      "packet_path": "run-artifacts/agentsflow/runs/2026-06-23-v0.2-pr-merge-readiness-rerun/review-packets/adversarial-claude.json",
      "report_path": "run-artifacts/agentsflow/runs/2026-06-23-v0.2-pr-merge-readiness-rerun/reviewer-report.adversarial-claude.json",
      "raw_output_path": "run-artifacts/agentsflow/runs/2026-06-23-v0.2-pr-merge-readiness-rerun/evidence/raw/adversarial-claude.raw.json",
      "invocation_metadata_path": "run-artifacts/agentsflow/runs/2026-06-23-v0.2-pr-merge-readiness-rerun/evidence/stale-external-invocations/8a2c197/reviewer-invocation.adversarial-claude.json",
      "status": "failed",
      "dispatch_started_at": "2026-06-23T08:16:49.214319+00:00",
      "dispatch_finished_at": "2026-06-23T08:26:23.215827+00:00",
      "stdout": "",
      "stderr": "external reviewer failed: Claude Code provider result must contain reviewer-report JSON\n",
      "exit_code": 2,
      "error": "external reviewer adversarial-claude failed: external reviewer failed: Claude Code provider result must contain reviewer-report JSON\n"
    }
  ],
  "error": "external reviewer verification-claude failed: external reviewer failed: Claude Code provider result must contain reviewer-report JSON\n; external reviewer architecture-claude failed: external reviewer failed: Claude Code provider result must contain reviewer-report JSON\n; external reviewer adversarial-claude failed: external reviewer failed: Claude Code provider result must contain reviewer-report JSON\n",
  "artifact_preparation_report": "run-artifacts/agentsflow/runs/2026-06-23-v0.2-pr-merge-readiness-rerun/review-artifact-preparation.json",
  "artifact_preparation_report_hash": "sha256:6619a770c1bd7b0f416b3bebf82cb2b68bc78e246574101c982179a94300c715"
}
